{
  "id": "ANALYSIS-006",
  "actor": {
    "type": "agent"
  },
  "activity": "internal-analysis",
  "content": {
    "kind": "architecture",
    "source": "specifications skill, diagram convention, skill-creator guidance, repository structure",
    "method": "ownership and rendering-boundary inspection",
    "observation": "현재 canonical source는 sectioned Specification JSON이고 Human view는 별도 Chrome extension으로 규정된다. 저장소에는 project Skill 및 local browser viewer 구현이 없고 app_server_goal.py는 Codex execution protocol launcher이지 Human viewer가 아니다.",
    "interpretation": "요청 방향은 project Skill을 AI source로 승격하고 local HTML/CSS/JS server를 Human-facing derived view로 새로 정의하며, diagram source는 inspectable data로 유지해야 한다.",
    "recommendation": "Specification은 기본 경로에서 제외하되 명시 요청용 선택 기능으로 남기고, local viewer는 project Skill·Git/task progress·diagram source를 읽기 전용으로 렌더링하도록 한다.",
    "limitation": "Specification 기능을 완전히 제거할지 선택 기능으로 유지할지는 Human이 아직 명시하지 않았다."
  },
  "relations": [
    {
      "type": "derived-from",
      "entryId": "DECISION-008"
    }
  ],
  "sequence": 28,
  "recordedAt": "2026-08-16T13:02:26.319458+00:00"
}
