{
  "id": "AGENT-001",
  "actor": {
    "type": "agent",
    "id": "main-agent"
  },
  "activity": "agent-response",
  "content": {
    "message": "codex_apps MCP 서버가 이번 세션 시작 때 초기화를 끝내지 못해 앱·커넥터 도구가 현재 세션에서 사용 불가능하다는 경고다. 일반 파일·셸·코딩 기능에는 보통 영향이 없으며, 재시작 후 /mcp 또는 codex mcp list로 상태를 확인한다. 반복되면 앱 인증·네트워크·시작 제한시간·플러그인 상태를 확인한다. 경고 한 줄만으로 정확한 원인은 확정할 수 없다."
  },
  "relations": [
    {
      "type": "responds-to",
      "entryId": "HUMAN-001"
    },
    {
      "type": "derived-from",
      "entryId": "WEB-001"
    }
  ],
  "sequence": 3,
  "recordedAt": "2026-08-12T14:35:53.175128+00:00"
}
