{
  "id": "AGENT-002",
  "actor": {
    "type": "agent",
    "id": "main-agent"
  },
  "activity": "agent-response",
  "content": {
    "message": "네 결함으로 범위를 한정한 Work Unit을 생성하며, 기존 canonical 자료 자동 변환·삭제와 unrelated uncommitted 변경은 제외하고 정확한 테스트 명령이 없으므로 tests not authorized로 기록한다."
  },
  "relations": [
    {
      "type": "responds-to",
      "entryId": "HUMAN-002"
    }
  ],
  "sequence": 4,
  "recordedAt": "2026-08-10T17:26:14.569917+00:00"
}
