{
  "id": "HUMAN-OWNERSHIP-001",
  "actor": {
    "type": "human"
  },
  "activity": "decision",
  "content": {
    "message": "Intake의 주체는 Main Agent와 Intake Agent다."
  },
  "relations": [
    {
      "type": "follows",
      "entryId": "HUMAN-DEFINITION-001"
    }
  ],
  "sequence": 2,
  "recordedAt": "2026-08-10T18:15:27.165036+00:00"
}
