{
  "id": "HUMAN-REWORK-002",
  "actor": {
    "type": "human"
  },
  "activity": "user-input",
  "content": {
    "message": "실패한 launcher 실행을 중지하고 재수정하라."
  },
  "relations": [
    {
      "type": "responds-to",
      "entryId": "RECOVERY-OUTCOME-001"
    }
  ],
  "sequence": 3,
  "recordedAt": "2026-08-10T17:40:59.021430+00:00"
}
